{
  "trial_id": "fixture-gcd-001",
  "experiment_id": "stage-b-fixture",
  "parent_trial_id": null,
  "branch_stage": null,
  "status": "ok",
  "start_time": "2026-07-27T16:04:26+00:00",
  "end_time": "2026-07-27T16:06:44+00:00",
  "params": {
    "FP": {
      "CORE_UTILIZATION": 38,
      "CORE_ASPECT_RATIO": 1.0
    },
    "PL": {},
    "CTS": {},
    "RT": {
      "FASTROUTE_LAYER_ADJUSTMENT": 0.2,
      "GRT_CONGESTION_ITERATIONS": 30
    }
  },
  "param_diff": {},
  "final_qor": {
    "wns_ps": -1460.26,
    "tns_ps": -61747.6,
    "area_um2": 5400.18,
    "power_w": 0.00937965
  },
  "stage_results": [
    {
      "stage": "FP",
      "status": "ok",
      "elapsed_s": 0.0,
      "exit_code": 0,
      "log_path": "iter0_FP.make.log",
      "stage_qor": {},
      "failure": null,
      "error_message": null
    },
    {
      "stage": "PL",
      "status": "ok",
      "elapsed_s": 0.0,
      "exit_code": 0,
      "log_path": "iter0_PL.make.log",
      "stage_qor": {},
      "failure": null,
      "error_message": null
    },
    {
      "stage": "CTS",
      "status": "ok",
      "elapsed_s": 0.0,
      "exit_code": 0,
      "log_path": "iter0_CTS.make.log",
      "stage_qor": {},
      "failure": null,
      "error_message": null
    },
    {
      "stage": "RT",
      "status": "ok",
      "elapsed_s": 0.0,
      "exit_code": 0,
      "log_path": "iter0_RT.make.log",
      "stage_qor": {},
      "failure": null,
      "error_message": null
    },
    {
      "stage": "finish",
      "status": "ok",
      "elapsed_s": 0.0,
      "exit_code": 0,
      "log_path": "iter0_finish.make.log",
      "stage_qor": {},
      "failure": null,
      "error_message": null
    }
  ],
  "failure": null,
  "error_message": null,
  "checkpoint": {
    "checkpoint_id": "cp-fixture-gcd-001-finish",
    "source_trial_id": "fixture-gcd-001",
    "stage": "finish",
    "param_hash": "141dec0566a6467a",
    "orfs_commit": "unresolved",
    "created_at": "2026-07-27T08:08:05.061089+00:00",
    "artifact_manifest": [
      {
        "file": "results/sky130hd/gcd/agenticpd_iter0/6_final.odb",
        "size_bytes": 3336446,
        "sha256": "8005a5305e6d3c411ea5023f4d6915f1f583942493e835b9e7476389e9aaf52f"
      },
      {
        "file": "results/sky130hd/gcd/agenticpd_iter0/6_final.def",
        "size_bytes": 401557,
        "sha256": "f794fd631e982d288d3c3b2713d73de76d7026880f21ecb181c14f46fb615687"
      },
      {
        "file": "results/sky130hd/gcd/agenticpd_iter0/6_final.v",
        "size_bytes": 47364,
        "sha256": "6eb64ac7833f3650f7d2e0d953ee0b5606c99373e323b45d8c807f658eb0157f"
      }
    ],
    "artifact_dir": "results/sky130hd/gcd/agenticpd_iter0"
  },
  "config_hash": null,
  "env_hash": null,
  "artifact_dir": "/home/cheatnut/OpenROAD-flow-scripts/flow/agenticpd/runs/20260727_160426"
}